{
  "$schema": "./release-profile.schema.json",
  "name": "maintainer",
  "displayName": "FlightFabric (Maintainer Edition)",
  "description": "Full codebase including developer diagnostics and dashboard tooling. For project maintainers only.",
  "extends": "developer",
  
  "include": {
    "backend_dirs": [],
    "frontend": [],
    "tools": [
      "flight-dashboard/**"
    ],
    "root": []
  },
  
  "exclude_patterns": [],
  
  "_comment": "Maintainer profile adds dashboard tooling while keeping package-local tests/ folders and shared integration tests excluded from app packages."
}
